{"datetime": "07.06.2025 12:16:18", "question": "Što je ETF?", "retrieved_context": "## ETF-ovi (Exchange Traded Funds)  \nETF-ovi su investicijski fondovi kojima se trguje na burzi, najčešće prate neki indeks. Nude diversifikaciju, niske troškove i likvidnost.  \nUCITS fondovi su profesionalno vođeni fondovi različitih strategija (aktivni i pasivni).", "answer": "ETF (Exchange Traded Fund) je investicijski fond koji se trguje na burzi i prati neki indeks, a nudi diversifikaciju, niske troškove i likvidnost."}
{"datetime": "07.06.2025 12:17:18", "question": "Što su investicijski fondovi?", "retrieved_context": "Investicijski fondovi - edukativni sazetak\nSto su investicijski fondovi?\nInvesticijski fond je oblik zajednickog ulaganja. Kupnjom udjela postajes suvlasnik fonda zajedno s", "answer": "Investicijski fondovi su oblik zajedničkog ulaganja kojim se skupljaju sredstva većeg broja ulagača, koji zajednički investiraju u razne vrijednosne papire i druge instrumente, s ciljem postizanja boljih kapitalnih dobiti nego što bi mogli učiniti samostalno. Tako, ulagači mogu pridobiti pogodnoj cijeni pristupiti raznim fin"}
{"datetime": "08.06.2025 10:26:01", "question": "Što je investicijski fond? ", "retrieved_context": "Investicijski fondovi - edukativni sazetak\nSto su investicijski fondovi?\nInvesticijski fond je oblik zajednickog ulaganja. Kupnjom udjela postajes suvlasnik fonda zajedno s", "answer": "Investicijski fond je oblik zajednickog ulaganja kojim se skupljaju sredstva više ulagača kako bi se investirali u razne financijske instrumente."}
{"datetime": "08.06.2025 10:30:36", "question": "Koji su najvažniji rizici ulaganja?", "retrieved_context": "# Rizici ulaganja", "answer": "Ne postoji jedan odgovarajući odgovor za najvažnije rizike ulaganja jer se rizici mijenjaju u ovisnosti o vrsti ulaganja, investitoru i tržišnim uvjetima. Međutim, neki od rizika koji su česti u ulaganju u tržišne instrumente uključuju: politički rizik, valutni rizik, rizik od promjene interesne stope, rizik"}
{"datetime": "08.06.2025 10:31:36", "question": "Koja je razlika između štednje i ulaganja?", "retrieved_context": "# Razlika između štednje i ulaganja", "answer": "Štednja je stavljanje novca na račun ili u kasnu svrhu, obično u obliku sporih, bezobveznih obveza, kao što su sporozna stavka ili savings account. Ulaganje je stavljanje novca u neki tržišni instrument, kao što su akcije, obveznice ili fondovi za investiciju, s naadom da će se vratiti više novca u budućnosti"}
{"datetime": "08.06.2025 10:32:20", "question": "Kako mogu započeti s ulaganjem u zlato?", "retrieved_context": "IZVOR: “5 koraka za uspješno ulaganje u zlato”, Centar Zlata", "answer": "Prvi korak za započetak ulaganja u zlato je otvoriti račun u tvrtki koja se bavi prodajom i čuvanjem zlata, kao što je Centar Zlata. Na njemu možete otvoriti digitalni ili fizički način, na izbor imate i razne oblike ulaganja kao što su kupovina baračića ili kovanih kovčega zlata.\n\nIzvori:\n1."}
{"datetime": "08.06.2025 10:33:18", "question": "Kako mogu prepoznati financijsku prijevaru?", "retrieved_context": "# Kako prepoznati i izbjeći financijske prijevare\n\n## Povijest i vrste financijskih prijevara", "answer": "Prvo, treba biti svjestan vrsta financijskih prijevara. Neke od najčešćih vrsta financijskih prijevara su:\n\n1. Investicijske piramide: Ovaj oblik prijevare se bavi prodajom nepostojanih ili niska vrijednostnih akcija ili papira. Investorima se obečavaju visoke dohodke, a nakon toga se svi, osim najranijih ulažača, ne"}
{"datetime": "08.06.2025 10:36:04", "question": "Koji su najvažniji rizici ulaganja?", "retrieved_context": "# Rizici ulaganja", "answer": "Ne postoji jedan odgovarajući odgovor za najvažnije rizike ulaganja jer se rizici mijenjaju u ovisnosti o vrsti ulaganja, investitoru i tržišnim uvjetima. Međutim, neki od rizika koji su česti u ulaganju u tržišne instrumente uključuju: politički rizik, valutni rizik, rizik od promjene interesne stope, rizik od bankrota, rizik od tržišnih volatiliteti i rizik od neproročene događaje (tzv. black swans). Rizici ulaganja u fizičke imovine, poput nepokretnih posjeda, različiti su i obuhvaćaju rizik od promjene tržišta, tehničke nezrelosti i održavanja troškova. Rekomendacija je svakom investitoru da se obrati"}
{"datetime": "08.06.2025 10:37:32", "question": "Koja je razlika između štednje i ulaganja?", "retrieved_context": "# Razlika između štednje i ulaganja", "answer": "Štednja je stavljanje novca na račun ili u kasnu svrhu, obično u obliku sporih, bezobveznih obveza, kao što su sporozna stavka ili savings account. Ulaganje je stavljanje novca u neki tržišni instrument, kao što su akcije, obveznice ili fondovi za investiciju, s naadom da će se vratiti više novca u budućnosti. Štednja je tada konzervativnija opcija za financiranje dugoročnih ciljeva, kao što su štednja za kuću ili starost. Ulaganje je riskantnija opcija i može donijeti veće profitne rezultate ali i veći rizik za gubitak novca."}
{"datetime": "08.06.2025 10:38:49", "question": "Kako mogu prepoznati financijsku prijevaru?", "retrieved_context": "# Kako prepoznati i izbjeći financijske prijevare\n\n## Povijest i vrste financijskih prijevara", "answer": "Prvo, treba biti svjestan vrsta financijskih prijevara. Neke od najčešćih vrsta financijskih prijevara su:\n\n1. Investicijske piramide: Ovaj oblik prijevare se bavi prodajom nepostojanih ili niska vrijednostnih akcija ili papira. Investorima se obečavaju visoke dohodke, a nakon toga se svi, osim najranijih ulažača, ne dobivaju vratitev svojih ulazaka.\n\n2. Zlonamjerni telefonski pozivi: Krivnici pozivaju potencijalne žrte s različitih poziva i nudi im novi posao ili pružaju neželjene savjete za različite finansijske pitanja. Cilj ovih poziva je dobiti važne osobne podatke ili dopuniti svojim zlostavljačkim nam"}
{"datetime": "08.06.2025 10:41:11", "question": "Što znači diverzifikacija portfelja?", "retrieved_context": "## Zlato  \nZlato se koristi za zaštitu od inflacije i diversifikaciju portfelja. Može se ulagati kroz fizičko zlato ili financijske instrumente (ETF-ovi, dionice rudarskih kompanija).\n\n# Diversifikacija", "answer": "Diversifikacija portfelja je strategija ulaganja koja se temelji na raspodjeli rizika prema što većem broju različitih klasa ulagačkih instrumenti, sa ciljem smanjenja rizika i povećanja povratka. Različitosti uključuju različite industrije, veličine kompanija i države ulaganja. Kada investitor ima raznoliko ulaganje, rizik od gubitka svega ulaganja kada se neka klasa gubi vrijednost smanjuje."}
{"datetime": "08.06.2025 10:42:41", "question": "Kako se mogu informirati o ulaganjima u Hrvatskoj?", "retrieved_context": "profesionalnim i kvalificiranim ulagateljima.\nKako i gdje se informirati prije ulaganja?\nPrije ulaganja u fond vazno je:\n- Procitati prospekt (temeljni dokument fonda s kljucnim informacijama).", "answer": "U Hrvatskoj postoje brojne izvori informacija koja mogu pomoći profesionalnim i kvalificiranim ulagateljima pri pripremi za ulaganje u fondove. Jedan od ključnih izvora informacija su prospekti fondova, koje su dostupni na web stranicama menadžera fondova ili Registarske agencije Hrvatske agencije za tržišne operacije (HAOT). Ostali izvori informacija uključuju novine, financijske časopisi i web stranice finansijskih institucija. Također, možete se odnositi na savet od strane finansijskih savetnika i menadžera fondova."}
{"datetime": "08.06.2025 10:44:01", "question": "Što su UCITS fondovi i koje su njihove prednosti?", "retrieved_context": "- Postoji mogucnost izvansudskog rjesavanja sporova, a ako to nije moguce, rjesavanje sporova\nprelazi na sud.\nKategorije UCITS fondova\n- Novcani fondovi: ulazu u trezorske zapise, najnizi rizik.\n- Obveznicki fondovi: ulazu u obveznice, nizak rizik.", "answer": "UCITS fondovi su fondovi koji se upravljaju prema Zakonu o UCITS fondovima (Undertakings for Collective Investment in Transferable Securities), koji definira standardne regulativne zahtjeve za fondove koji se mogu prodavati preko europske tržišne unije. Prednosti UCITS fondova uključuju:\n\n1. Standardizirani zakonski okvir: UCITS fondovi moraju se upravljati prema zakonu, što pruža investitorima sigurnosni okvir za investiciju.\n2. Lakše registracija i prodaja: UCITS fondovi mogu biti registrirani u više država EU-a, što pomaže u prodaji i distribuciji fondova kroz Europsku tržišnu uniju.\n3. Diversifikacija: UCITS fondovi mogu sadržavati raznoliku raspodjelu vrijednosnih papira, što pruž"}
{"datetime": "08.06.2025 10:45:07", "question": "Koje su prednosti i mane ulaganja u kriptovalute?", "retrieved_context": "- Uvijek informiraj se o svim troskovima i rizicima prije ulaganja.\n- Redovito prati svoja ulaganja i uci iz iskustva.\n- Ne ulazi novac koji ti je potreban za osnovne zivotne potrebe.", "answer": "Prednosti:\n- Potencijalno visoke stotinice i tisućice % profit.\n- Deklarirana namjera neke kriptovaluta da imaju ograničenu količinu, što može dovesti do povećanja cijene.\n- Neovisni i decentralizirani sustav koji nije kontroliran s strane vlade ili banke.\n\nMani:\n- Visok rizik, mogućnost gubitka svog ulaganja.\n- Poteškoće s registracijom, sigurnosnim ključem i drugim tehničkim detaljima.\n- Poteškoće s identifikacijom legitimnog izvora i zakonodavstva.\n\nUz to, svaki investitor mora osjećati odgovjnu dužnost da se izvjedi svoje ulaganje, tj. da istraži kriptovalutu, provjere je li to legitimna tehn"}
{"datetime": "08.06.2025 10:48:00", "question": "Kako procijeniti isplativost nekog ulaganja?", "retrieved_context": "profesionalnim i kvalificiranim ulagateljima.\nKako i gdje se informirati prije ulaganja?\nPrije ulaganja u fond vazno je:\n- Procitati prospekt (temeljni dokument fonda s kljucnim informacijama).", "answer": "Kako biste procijenili isplativost nekog ulaganja, morate se usredotočiti na neke ključne faktorice:\n1. Ciljani segment tržišta i konkurentsko okruženje.\n2. Ekonomska stabilnost i politička situacija u državi gdje je fond smješten.\n3. Stanje i trendovi tržišta i industrije koju pokriva fond.\n4. Izraženost i iskustvo menadžera fonda i njegovih stručnjaka.\n5. Učinak i isplativost fonda u prošlosti i trenutnom stanju.\n6. Količina i struktura troškova (upravljačkih i drugih).\n7. Ponajviše, obaviti što bolji analitički raspored i obaviti indepth istraživanje i analizu podataka koja su dostupna.\n\nNakon što ste"}
{"datetime": "08.06.2025 11:03:37", "question": "Koji su najčešći oblici financijske pismenosti?", "retrieved_context": "Financijska pismenost bitna je za donošenje ispravnih odluka o štednji i ulaganju. Osobe koje bolje razumiju pojmove, instrumente i rizike financijskih tržišta češće i uspješnije investiraju, a manje riskiraju gubitak vrijednosti kroz inflaciju.", "answer": "Najčešći oblici financijske pismenosti uključuju:\n\n1. Razumijevanje osnovnih pojmova: inflacija, investicije, obveznice, risk, stopa lica, kapital, tržište, i dr.\n2. Razumijevanje financijskih instrumenta: obveznice, akcije, opticije, futuri, derivativi, ETF-ovi, i dr.\n3. Razumijevanje financijskih rizika: sistemski rizik, market risk, credit risk, liquidity risk, i dr.\n4. Sposobnost razumjeti i analizirati financijske izvještaje i izvještaje o operacijama tvrtke.\n5. Sposobnost planirati financije za budućnost: osiguranje, penzionisanje, štednja, i dr.\n6. Sposobnost odabirati i upravljati financijskim produktima i usl"}
{"datetime": "08.06.2025 11:12:35", "question": "Koje su prednosti i mane ulaganja u kriptovalute?", "retrieved_context": "- Uvijek informiraj se o svim troskovima i rizicima prije ulaganja.\n- Redovito prati svoja ulaganja i uci iz iskustva.\n- Ne ulazi novac koji ti je potreban za osnovne zivotne potrebe.", "answer": "Prednosti ulaganja u kriptovalute:\n1. Veliki potencijal za visoke dobiti.\n2. Neovisnost od centralnih banaka i tradicionalnih financijskih institucija.\n3. Dostupnost i lak pristup za svake ljude bez obzira na gdje žive ili koliko imaju novca.\n4. Novi način na investiranje i diversifikaciji riskova.\n5. Tehnologija blokirane lanaceva (Blockchain) ima veliku primjenu i mogućnosti.\n\nMane ulaganja u kriptovalute:\n1. Visoka volatilnost i rizik od gubitka cijeli kapital.\n2. Nedostatak ključnih regulatornih okvira i zakona.\n3. Risk od hacking i tehnoloških poteškoći.\n4. Neisplativa trajnost i potreba za visokim troškovima za držanje i sigurnost ulagan"}
{"datetime": "08.06.2025 11:29:35", "question": "Koje su prednosti i mane ulaganja u kriptovalute?", "retrieved_context": "- Uvijek informiraj se o svim troskovima i rizicima prije ulaganja.\n- Redovito prati svoja ulaganja i uci iz iskustva.\n- Ne ulazi novac koji ti je potreban za osnovne zivotne potrebe.", "answer": "Prednosti ulaganja u kriptovalute uključuju potencijalno visoke stope rasta vrijednosti, decentralizaciju i autonomiju, te visoku tehnološku inovaciju. Međutim, mane uključuju visoke rizike (poput tečajnih i tehničkih rizika), nezavršene tehnološke inovacije, kriminalne aktivnosti, i nepostojanje regulatorne okruženja. Uvijek se prije ulaganja informiraj o svim troskovima i rizicima, redovito prati svoja ulaganja i uci iz iskustva, te ne ulazi novac koji ti je potreban za osnovne zivotne potrebe."}
{"datetime": "08.06.2025 11:31:10", "question": "Koji su najčešći oblici financijske pismenosti?", "retrieved_context": "Financijska pismenost bitna je za donošenje ispravnih odluka o štednji i ulaganju. Osobe koje bolje razumiju pojmove, instrumente i rizike financijskih tržišta češće i uspješnije investiraju, a manje riskiraju gubitak vrijednosti kroz inflaciju.", "answer": "Financijska pismenost se može postići putem izučavanja tema kao što su osnovni finansijski izrazi i pojmovi, matematika vezana za financijske operacije, poznavanje financijskih instrumenta i tržišta, razumijevanje gospodarskih trendova i teorija financija."}
{"datetime": "08.06.2025 11:32:11", "question": "Kako se zaštititi od lažnih investicijskih ponuda?", "retrieved_context": "Investicijski fondovi - edukativni sazetak\nSto su investicijski fondovi?\nInvesticijski fond je oblik zajednickog ulaganja. Kupnjom udjela postajes suvlasnik fonda zajedno s", "answer": "Kako bi se zaštitili od lažnih investicijskih ponuda, investitori trebaju provjereći povjerenika i fond, provjereći sadržaj ponude i tražiti savjete od stručnih savjetnika."}
{"datetime": "08.06.2025 11:33:38", "question": "Što znači “passivno ulaganje”?", "retrieved_context": "- Stednja je sigurna, ali ne stiti uvijek od inflacije. Ulaganje moze donijeti veci prinos, ali i veci rizik.\n- Vazno je imati cilj, informirati se o rizicima i mogucnostima, te diversificirati ulaganja.\n7. Prakticni savjeti za mlade ulagace\n- Pocni stedjeti i ulagati sto ranije, pa makar i malim iznosima.\n- Uvijek informiraj se o svim troskovima i rizicima prije ulaganja.", "answer": "Passivno ulaganje znači investirati u fondove ili druge tržišne instrumente koji slijede performansu odabranog indeksa, a ne aktivan uložak. U tom slučaju, investitor ne može direktno utjecati na izbor kompanija ili odluke o ulaganju, već se oslanja na menadžere fonda ili indeks koji to rade za njih."}
{"datetime": "08.06.2025 11:34:23", "question": "Zašto je važno početi ulagati što ranije?", "retrieved_context": "# Zaključak\n\nUlaganje je dostupno svima, ali zahtijeva osnovnu edukaciju i planiranje. Kreni polako, informiraj se i biraj raznolike investicije prema svojim ciljevima i riziku.\n\n---\n\nIZVOR: “Ulaganje za početnike”, Štedopis, 2024.", "answer": "It's important to start investing early because the power of compound interest can significantly increase your returns over time."}
{"datetime": "08.06.2025 11:37:05", "question": "Zašto je važno početi ulagati što ranije?", "retrieved_context": "# Zaključak\n\nUlaganje je dostupno svima, ali zahtijeva osnovnu edukaciju i planiranje. Kreni polako, informiraj se i biraj raznolike investicije prema svojim ciljevima i riziku.\n\n---\n\nIZVOR: “Ulaganje za početnike”, Štedopis, 2024.", "answer": "It's important to start investing early because the power of compound interest can significantly increase your returns over time."}
{"datetime": "08.06.2025 11:40:22", "question": "Zašto je važno početi ulagati što ranije?", "retrieved_context": "# Zaključak\n\nUlaganje je dostupno svima, ali zahtijeva osnovnu edukaciju i planiranje. Kreni polako, informiraj se i biraj raznolike investicije prema svojim ciljevima i riziku.\n\n---\n\nIZVOR: “Ulaganje za početnike”, Štedopis, 2024.", "answer": "Za početnike, važno je početi ulagati što ranije jer se vrijeme i rast kapitala prema zakonu trokuta utječu na konačni rezultat. Ulaganje ranije omogućava veću vremenu korištenje rastućem kapitalu i manje ovisnost o konkretnom trenutku. Zbog toga, što ranije počnete, to vam daje veći izbor strategija i raznolikijeg portfelja, te manje rizika od nepoželjnih izvjesenja."}
{"datetime": "08.06.2025 11:41:54", "question": "Koje su porezne obveze pri ulaganju u Hrvatskoj?", "retrieved_context": "- Uvijek informiraj se o svim troskovima i rizicima prije ulaganja.\n- Redovito prati svoja ulaganja i uci iz iskustva.\n- Ne ulazi novac koji ti je potreban za osnovne zivotne potrebe.", "answer": "Porezne obveze pri ulaganju u Hrvatskoj zavise od oblika ulaganja i vaše državljanstva. Obično se primjenjuju porez na kapitalni dobitak (10% za državljane i 15% za strance) i porez na dobitak od poslovanja (od 10 do 30%). Prilazite svom financijskom savjetniku ili Hrvatskom državnom agenciji za porez za točnije informacije.\n\nNa engleskom jeziku: The tax obligations when investing in Croatia depend on the type of investment and your citizenship. Generally, there is a capital gains tax (10% for citizens and 15% for foreigners) and a tax on business profit (from 10% to 30%). Consult your financial advisor or the Croatian Tax Administration for more accurate information."}
{"datetime": "08.06.2025 11:43:28", "question": "Ne postoji jedan odgovarajući odgovor za najvažnije rizike ulaganja jer se rizici mijenjaju u ovisnosti o vrsti ulaganja, investitoru i tržišnim uvjetima. Međutim, neki od rizika koji su česti u ulaganju u tržišne instrumente uključuju: politički rizik, valutni rizik, rizik od promjene interesne stope, rizik od bankrota, rizik od tržišnih volatiliteti i rizik od neproročene događaje (tzv. black swans). Rizici ulaganja u fizičke imovine, poput nepokretnih posjeda, različiti su i obuhvaćaju rizik od promjene tržišta, tehničke nezrelosti i održavanja troškova.", "retrieved_context": "# Rizici ulaganja\n\n- Tržišni rizik: vrijednost investicija može rasti ili padati\n- Kreditni rizik: izdavatelj obveznice možda neće vratiti novac\n- Likvidnosni rizik: teškoća prodaje imovine\n- Inflacija: može smanjiti realnu vrijednost povrata\n- Regulacija i porezi: pravila se mogu mijenjati\n\n# Psihologija ulaganja", "answer": "Ne postoji jedan odgovarajući odgovor na pitanje o najvažnijim rizicima ulaganja jer se rizici mijenjaju u ovisnosti o vrsti ulaganja, investitoru i trži"}
{"datetime": "08.06.2025 11:44:41", "question": "Koji su najvažniji rizici ulaganja?", "retrieved_context": "- Uvijek informiraj se o svim troskovima i rizicima prije ulaganja.\n- Redovito prati svoja ulaganja i uci iz iskustva.\n- Ne ulazi novac koji ti je potreban za osnovne zivotne potrebe.", "answer": "Neovisno o tome što uljevaš u ulaganja, najvažniji rizici su nepoznatost tržišta i nepoznatost kompanije u kojoj uljevaš. Zato je važno informirati se o svim troskovima i rizicima prije ulaganja i redovito pratiti svoja ulaganja kako bi se učio iz iskustva. Zapravo, iako ne ulazim novac koji mi je potreban za osnovne zivotne potrebe, i dalje bih se prethodno obavio istraživanja i analize tržišta i kompanije."}
{"datetime": "08.06.2025 11:46:29", "question": "ako mogu prepoznati financijsku prijevaru?", "retrieved_context": "1. Postavi ciljeve (prinos, rizik, likvidnost, vremenski horizont).\n2. Izradi investicijsku strategiju – odredi koliko ulažeš i u što.\n3. Redovito prati i prilagođavaj portfelj, po potrebi.", "answer": "Ako ne poznavate investicijsku strategiju i ciljeve, te niste sposobni razumjeti finančne izvještaje i statistike, te nemate volju i vremena za redovito pratnje i prilagođavanje portfelja, tako ne možete u potpunosti prepoznati financijsku prijevaru. Ali, čak ni oni koji znaju, nisu potpuno sigurni od prijevare, jer financijski tržište je neprevidno i nepredvidivo. Jedino se može smanjiti rizik poštivanjem osnovnih principla tržišne vrijednosti i načela dobrih poslovanja.\n\nIn English (for those who prefer it):\n\nContext:\n1. Set your goals (contribution, risk, liquidity, time horizon).\n2. Develop an investment strategy – determine how much and in what.\n3. Regularly monitor and adjust your portfolio accordingly.\n\nQuestion: how can I identify financial"}
{"datetime": "08.06.2025 11:56:07", "question": "Što su UCITS fondovi i koje su njihove prednosti?", "retrieved_context": "UCITS fondovi su profesionalno vođeni fondovi različitih strategija (aktivni i pasivni).", "answer": "UCITS fondovi su profesionalno vođeni fondovi, koji se u skladu s propisima EU, moraju poštovati poznate standardne kriterije za razvoj, upravljanje i izvješćivanje. Njihove prednosti uključuju razumno visoke minimume ulaganja, transparenciju i lak pristup za investiciju, te kvalitetno obavljanje administrativnih poslova i osiguranje štednji."}
